,Date,Tweet
1734,2022-04-03 14:34:25+00:00, siap yop ditunggu 
1735,2022-04-03 14:32:23+00:00, ohagi 
1736,2022-04-03 14:31:59+00:00, uwahh dibangunin sahur 
1737,2022-04-03 14:31:37+00:00, di tunggu jadwalnya yop 
1738,2022-04-03 14:28:44+00:00, uwooh tskr yop di bangunin sahur sama yopi 
1739,2022-04-03 14:25:49+00:00, iopi masih ngigou kah 
1740,2022-04-03 14:25:45+00:00, dibangunin sahur sama ayang 
1741,2022-04-03 14:24:44+00:00, makasih yop buat alarm nya 
1742,2022-04-03 14:24:37+00:00, pagi yopi 
1743,2022-04-03 14:22:40+00:00, jadi gini guys aku takut nanti mlah lebih susah bangun karena alarmnya ku snoozterus demi deng 
1744,2022-04-03 14:22:30+00:00, ohayopi ww 
1745,2022-04-03 14:21:18+00:00, sedullll letgoo 
1746,2022-04-03 14:19:28+00:00, wow paket lengkapp 
1747,2022-04-03 14:19:13+00:00, ada versi berisiknya gak 
1748,2022-04-03 14:19:07+00:00, gabung membership demi dibanguni sama ayang 
1749,2022-04-03 14:18:59+00:00, bagaimana caranya mudah sekali untuk bergabung kira kira klu
1750,2022-04-03 14:18:48+00:00, dibangunin sahur ama yopik beh pa 
1751,2022-04-03 14:18:29+00:00, pagi yopii part 
1752,2022-04-03 14:17:54+00:00, pagi teh rani 
1753,2022-04-03 14:17:36+00:00, waduuu mantappp makasih yopp 
1754,2022-04-03 14:17:26+00:00, otw jadiin alarm 
1755,2022-04-03 14:17:19+00:00, okyoppp tapi jangan terlalu padet ya kalo masih sakit 
1756,2022-04-03 14:17:17+00:00, uwoghhhhhhhh dibangun sama ayang yopi very tskrrrrrrr 
1757,2022-04-03 14:17:04+00:00, uwu sahur dibangunin ayang 
1758,2022-04-03 14:16:48+00:00, wihhh serius yopppp makasih banyak yopiii 
1759,2022-04-03 14:15:15+00:00, pagi yopi tapi kok disini malam ya 
1760,2022-04-03 14:13:22+00:00, malam yopi 
1761,2022-04-03 14:12:15+00:00, pagi 
1762,2022-04-03 14:11:38+00:00, ohhhhhhh ditunggu schedulnya 
1763,2022-04-03 14:11:35+00:00, hhahah pagi iofi part 
1764,2022-04-03 14:11:33+00:00, pagi juga part 
1765,2022-04-03 14:11:17+00:00, pagi cayank 
1766,2022-04-03 14:11:13+00:00, niditunggu schedulnya 
1767,2022-04-03 14:11:05+00:00, yuk yuk 
1768,2022-04-03 14:10:51+00:00, pagi yopi 
1769,2022-04-03 14:10:34+00:00, pagi 
1770,2022-04-03 14:10:33+00:00, pagi top www 
1771,2022-04-03 14:10:32+00:00, pagi yopiii deadlingimana kabar www 
1772,2022-04-03 14:10:32+00:00, pagii yopi 
1773,2022-04-03 14:10:23+00:00, pagi iofi 
1774,2022-04-03 14:10:20+00:00, pagiii part 
1775,2022-04-03 14:10:11+00:00, pagi 
1776,2022-04-03 14:10:10+00:00, pagi w 
1777,2022-04-03 11:58:04+00:00, dek udah abang bilang jangan main kecoak jorok dek eh eh eh dek kecoaknya jangan dimakan buang buang hii jorok 
1778,2022-04-03 11:39:37+00:00, wakaru 
1779,2022-04-03 11:14:49+00:00, sama tapi klo aku obat batuk rasanya bikin ngantuk banget dan gak bisa ditahan pasti ujung ujungnya tidur 
1780,2022-04-03 10:22:36+00:00, sering sering baca doujin yop pasti terasah dengan sangat mantap 
1781,2022-04-03 10:16:06+00:00, samyop i feel your pain yop gimana caranya ngehalu sama husbu kalo ga bisa gambar cogan d 
1782,2022-04-03 09:57:07+00:00, cepet sembuh ya yopi 
1783,2022-04-03 09:56:38+00:00, inhaler balsem vaporu vicks hirup uap panas nasal spray atau kalo berani bersihin hidung pa 
1784,2022-04-03 09:06:11+00:00, wkwkwkwk smngatt yopiii deadlinnyaaa jngan kecapean ya bebebhahaha 
1785,2022-04-03 08:50:40+00:00, sangat amat menggokil 
1786,2022-04-03 08:07:40+00:00, pagi yopiii sayaang 
1787,2022-04-03 08:06:30+00:00, cari referensi dari tag bl dan yaoi lah yop 
1788,2022-04-03 07:34:32+00:00, met pagi 
1789,2022-04-03 07:18:05+00:00, coba liat stream archivtahun lalu yopi bikin holoid ikemen mungkin ww ganbareeyopiiii yuk 
1790,2022-04-03 07:14:14+00:00, pagi yopi senpai 
1791,2022-04-03 06:34:32+00:00, itu tidur apa makan bsampsehari 
1792,2022-04-03 06:31:01+00:00, pagi yopi 
1793,2022-04-03 06:12:06+00:00, pagi airaniiii 
1794,2022-04-03 06:02:50+00:00, waduh obat flu apaan samptidur 
1795,2022-04-03 06:00:15+00:00, kebanyakan gambar cewek lupa gambar cowok 
1796,2022-04-03 05:55:29+00:00, klo yopi aja desperatapalagi saya yop ww 
1797,2022-04-03 05:54:48+00:00, waduu mangat ya yop d 
1798,2022-04-03 05:51:36+00:00, semoga flu nya bisa segera sembuh ya iofi 
1799,2022-04-03 05:47:26+00:00, siang kak yopi 
1800,2022-04-03 05:38:55+00:00, berjuang lah 
1801,2022-04-03 05:32:55+00:00, mungkin minum obat flu yang gak bikin ngantuk yop kan ada tuh also semoga cepat sembuh ya 
1802,2022-04-03 05:29:23+00:00, obat flu anda kuat sekali iofi 
1803,2022-04-03 05:28:11+00:00, deadlinnya di kejar death match ikzzzzzzz 
1804,2022-04-03 05:26:00+00:00, wah selamat istirahat dan semangat kejar deadlinnya yop 
1805,2022-04-03 05:19:12+00:00, waduhh bisa kali tidur goodluck deh buat deadlinnya emang obat flu apa yg bisa bikin tidur 
1806,2022-04-03 05:13:55+00:00, memang obat flu banyakan gitu yop btw good luck for thdeadlin a 
1807,2022-04-03 05:12:39+00:00, semoga cepet sembuh iofi 
1808,2022-04-03 05:12:23+00:00, good luck sensei semangat terus 
1809,2022-04-03 05:08:33+00:00, ahhh deadlinbener bener meresahkan istirahat jadi tidak tenang good luck ngerjain deadlin 
1810,2022-04-03 05:08:02+00:00, semangat deadlinenya 
1811,2022-04-03 05:07:38+00:00, waduuu gws ya yop dan good luck sama deadlinnya ww 
1812,2022-04-03 05:07:08+00:00, walah buset kamu minum obat apaan yg bs tdr begitu semangat deh ya yop d 
1813,2022-04-03 05:06:52+00:00, cepat sembuh ya 
1814,2022-04-03 05:06:32+00:00, fiks efek tremenza klo obat flu yg bikin ngantuk www 
1815,2022-04-03 05:06:32+00:00, pagi 
1816,2022-04-03 05:06:26+00:00, gws yopi 
1817,2022-04-03 05:06:21+00:00, gws yopii banyak minum air anget yop 
1818,2022-04-03 05:06:18+00:00, mungkin bisa nyari obat flu yang tidak bikin ngantuk yop semoga cepat sembuh 
1819,2022-04-03 05:06:14+00:00, pagi behmmmm 
1820,2022-04-03 05:06:08+00:00, jangan bilang obat deaminyg diminum 
1821,2022-04-08 03:24:50+00:00,wah bahas motogp nih eh salah bahas legenda putri mandalika guys yuk pantengin streamnya ntar malem mandalika 
1822,2022-04-08 03:04:01+00:00,besok abis freetalk langsung gasss goyang bossqu link funkot dugem onlinanisong 
1823,2022-04-08 02:53:51+00:00,insyallah jadwal nanti di updatlagi vtuber vtuber vtuberdebut vtuberuprising vtuberid formula 
1824,2022-04-08 02:29:18+00:00,pagi guys gimana nih pengumuman kemarin pada eited gak besok ada konten apa vtuber vtubers envtuber 
1825,2022-04-08 02:28:53+00:00,finally big thanks buat udah mau ngegambarin jadi perkenalkan nama saya afivin sherflock seorang bod 
1826,2022-04-08 01:40:02+00:00,tidak terasa sudah hari k audisi ayo segera ikuti audisinya jangan sampai kelewatan audisi akan dilaksanakan 
1827,2022-04-08 01:00:01+00:00,kuat sampai sahur nggak ya reetalk xmenunggu bersamamu oi id cjumat april wi gmt clink 
1828,2022-04-08 00:34:27+00:00,aku mau kenalan sama vtuber id tapi gatau mau mulai dari mana aku mau kenalan sama kalian semuaa vtuberid vtuberindonesia 
1829,2022-04-07 23:34:29+00:00,selamat pagi semuanya sedikit pesan pagi dari aku dan reisth kkalian heh d d vtuberid envtuber 
1830,2022-04-07 21:13:05+00:00,yuk yang lagi gabut atau butuh moodbooster merapat kchannel hidayat insya allah biar hidayat makin semangat 
1831,2022-04-07 20:51:02+00:00,selamat pagi selamat berpuasa bagi yang menjalankannya sekarang coco sedang main genshin impact semoga bisa menem 
1832,2022-04-07 19:41:35+00:00,sahuuur sambil ngeeeeeenggggg jumat april jam wi senaredo nfs 
1833,2022-04-07 18:34:19+00:00,halo semua salam kenal aku ryunez baru mau mulai jadi vtuber jadi lagi buat karakter di tunggu ya vtuber vtuberid 
1834,2022-04-07 16:39:38+00:00,otra sankyu semua yang sudah mampir yang sudah temani chat juga sankyu juga untuk yang udah donat kita k 
1835,2022-04-07 15:58:27+00:00,uhuyyy senangnya dalam hati kalau vtuber vtuberid 
1836,2022-04-07 15:12:32+00:00,assalamualaikum wr w yuk cek updatkonten terbaru hidayat hehevtuber vtubers 
1837,2022-04-07 15:08:15+00:00,ganti rencana sahuuur karena banyak event genshin belum dimainin jadi main genshiiin duluuuu umat april 
1838,2022-04-07 15:07:05+00:00,lanjut dsni aj yuk ramein wwww sinners vtuberid 
1839,2022-04-07 15:06:11+00:00,memilih nyari kencan sama hantu link horror devour 
1840,2022-04-07 14:37:18+00:00,yuk gais yang mau mabar dota atau yang mau ngobrol ngobrol bisa mampir ktwitch nya kak joana maoh jangan lupa d 
1841,2022-04-07 13:59:19+00:00, temenin yuk dota livestreaming vtuberuprising vtuberid vtubers 
1842,2022-04-07 13:40:31+00:00,haelagu gaiss yuk mampir kkotoba station malem ini ada bang noyomi yang lagi maen gamskul nih yuk ramein j 
1843,2022-04-07 13:18:00+00:00,siapa yang udah kenyang atau masih lapar kuy ngobrolin makanan makanan indonesia 
1844,2022-04-07 13:11:55+00:00,selamat malam selamat beristirahat karena ini malam jumat sekarang coco akan main gamhoror resident evil semo 
1845,2022-04-07 12:20:45+00:00,gampenghilang stress tanggal april jam wilink vtuber 
1846,2022-04-07 12:15:47+00:00,halo aku perlu jasa komisi untuk art vtuber dan riggingnya chara ku ada armor sayap desainnya mungkin juga cuk 
1847,2022-04-07 12:14:34+00:00, gaming kali ini gw akan menjalankan quest archon semoga gak ada halangan lagi dat april tim 
1848,2022-04-07 12:12:12+00:00,jadi gini vtuber vtubers envtuber jpvtuber vtuberuprising a avtuber vtuberid 
1849,2022-04-07 12:08:53+00:00, jangan dibaca soalnya t shirt untuk masih dijual nanti kamu kepen 
1850,2022-04-07 12:08:30+00:00,ai no kotoba cover shoutabepremier april ini masih trailer v vtuber vtuberid 
1851,2022-04-07 12:08:23+00:00,hari ini gw balek stream lagi nih manteman kali ini edisi maljum horyor banget gatau nih horor apa kaga soalny 
1852,2022-04-07 11:57:05+00:00,riot tolong lah kok anda goda saya dah jangan mengejek saya karena tanggal muda riotgames valorant 
1853,2022-04-07 11:32:30+00:00,jadwal livestream malam ini gmt phasmophobia verionlivvtuber 
1854,2022-04-07 10:49:29+00:00, ngabuburit qualifying lanjutt gp bahrain vtuber indonesia vtuber vtuber 
1855,2022-04-07 10:49:28+00:00,hari sabtu ini april ini kita ada ngobrol santuy nih bareng leyhad alberich bakalan ngomongin apa ya r 
1856,2022-04-07 10:37:01+00:00,alhamdulillah lancar baca al qur an dari juz kjuz semoga hari ini mendapatkan berkahnya amiiin hidrora 
1857,2022-04-07 10:18:16+00:00,di gombalin dita vtuber vtuberuprising vtuberid twitchstreamers twitch twitchclips 
1858,2022-04-07 09:59:04+00:00,selamat sorgimana kabarnya sekarang coco sedang main call oduty mobil semoga bisa menemani ngabuburit kamu 
1859,2022-04-07 09:53:05+00:00,donathon adu mekanik lagi pisod vtuber vtuberid vtuberindonesia 
1860,2022-04-07 09:28:49+00:00,lebih baik telat sedikit daripada gak jadi let s go nyobain gamlain kalau bisa tolong bantuin karena veela nu 
1861,2022-04-07 09:25:00+00:00, model reveal halo thana kusuma disini apa kalian nyasar kemari tentunya itu bukan karena saya banshega 
1862,2022-04-07 09:07:16+00:00,tips biar puasa kamu gak gampang batal fyp fyp askargreshaqi askartips indievtuber vtuberid 
1863,2022-04-07 08:45:34+00:00, vtuber id en subs celebration kita main gamhorror besok tanggal april pukul yuki bakal meray 
1864,2022-04-07 08:06:50+00:00, mengaji lanjut mengaji juz semoga bulan puasa ini mendapatkan berkahnya amiiin dat april tim 
1865,2022-04-07 08:02:03+00:00,masih kuat puasa nya yuk kita ngobrol lagi apr gmt via youtuseyo 
1866,2022-04-07 07:57:17+00:00, ini dia lagu kanaria ironiyang saya cover silahkan mampir vtuber vtuberid 
1867,2022-04-07 07:46:39+00:00,sudah saya post manteman vtuberassets vtuberid vtuber 
1868,2022-04-07 07:28:08+00:00,kwbanwaa w malam ini yuki anak magang akan bermain identityv gmt 
1869,2022-04-07 07:21:46+00:00,yacharoo minna wihh pembukaan server minecraft membership nih kira kira bakal langsung ramai gak ya yuk buat r 
1870,2022-04-07 07:12:41+00:00,selamat siang apakah kalian lagi nunggu buka puasa yuk ngobrol sama aku sambil nunggu buka puasa fretalk n 
1871,2022-04-07 07:11:06+00:00,nikahhhh nikaaah akhirnya sama clifwoohoooo kamis april jam wi 
1872,2022-04-07 06:47:58+00:00,gass malem ini kita main gamhorror volumharap di kecilakn soalnya suara jantan anak sangat lakik jam mlm 
1873,2022-04-07 05:51:14+00:00, cover saujana suci sekeping hati full on vtuberid vtubers nasheed 
1874,2022-04-07 05:22:54+00:00,lesgoww gais mampir kstream nta kak jo nguli sekalian nunggu buka emang biasa jomali nunggu buka puasa dari ja 
1875,2022-04-07 05:11:35+00:00,spoiler talent firefly media yg sudah lulus audisi seorang idol penyebar kebahagiaan ingin dikenang popula 
1876,2022-04-07 05:10:08+00:00,aku aku aku pekaan ko mungkin tanggal april jam wilink 
1877,2022-04-07 04:59:27+00:00,horror lagi yok vtuberid rasumaid thebeastinsid
1878,2022-04-07 04:53:29+00:00,donathon makan samyang amp hand reveal spesial k subs rdha vtuber vtuberid vtuberindonesia 
1879,2022-04-07 04:51:07+00:00,pagiii semuanya malam ini spesial malam jumat kita bakal cerita cerita pengalaman horror nih buat kamu yang mau 
1880,2022-04-07 04:48:19+00:00,otsurandom d new unit on trakteer guys karena ngga dibolehin minum boba vtuberuprising 
1881,2022-04-07 02:41:24+00:00,selamat pagi bagaimana kabarnya sekarang coco sedang mencoba untuk menggambar sekaligus freetalk semoga kamu suka 
1882,2022-04-07 02:29:22+00:00,anyway manti malem mion bakal stream menjelajah kuliner indonesia nich jangan lupa mampir ya kasih tau mion maka 
1883,2022-04-07 02:26:28+00:00,malam malam mau ngapain selena malam ini mau belajar bahasa jepang belajar bahasa jepang seru gak ya uolingo 
1884,2022-04-07 01:35:39+00:00,halo para diner nanti dinisa bakal livstreaming desain overlay layout buat livestreaming hari ini april jam 
1885,2022-04-07 01:00:01+00:00,ketika teman teman sudah kliling dunia starla masih di kasur uolingo xga bisa basa enggres oi id ckamis 
1886,2022-04-07 00:09:10+00:00,ngobrol bareng kyubii jam sorwiyahh gaesss freetalk aburr ada premannn april 
1887,2022-04-06 23:55:20+00:00,ohayooon i reached subs makasih banyak yang udah support mion a minggu depan mion bakal stream selebrasi 
1888,2022-04-06 23:31:23+00:00,audisi hari k berikut sedikit preview dari salah satu karakter yang kami audisikan menurut kamu bagaimana si 
1889,2022-04-06 21:43:16+00:00,menolak tidur setelah sahur livon vtuberid vtuberuprising 
1890,2022-04-06 21:03:00+00:00, jam lagi vtuber vtuberid 
1891,2022-04-06 20:50:29+00:00,selamat pagi selamat berpuasa bagi yang menjalankannya sekarang coco sedang main genshin impact semoga bisa menem 
1892,2022-04-06 20:27:36+00:00,sini yang baru imsak udah laper lagi hwongdesou vtuber vtuberid 
1893,2022-04-06 17:12:55+00:00,lets ngeutaitsampai sahur tibah apr gmt jst utaitemitta vivionstream vtuberuprising 
1894,2022-04-06 15:37:19+00:00,halooo semuaa perkenalkan namaku vii kedepannyaa aku bakal main apelegend dan yu gi oh master duel salam 
1895,2022-04-06 14:45:11+00:00,jalan jalan di shibuya sambil freetalk vtuber vtuberid vtuberuprising 
1896,2022-04-06 14:41:53+00:00, ragp pembuka di australia modhard vtuber indonesia vtuber vtuber 
1897,2022-04-06 14:30:41+00:00,assalamualaikum wr w yuk cek updatkonten terbaru hidayat hehlink on bio vtuber 
1898,2022-04-06 14:27:57+00:00,mengapedengan santuy apeegends rasumaid collabkawan vtuberid 
1899,2022-04-06 14:11:25+00:00,haihoo uhum futsu coba main minecraft survival amp server futsuri sendiri loh kalian juga bisa main bareng di ser 
1900,2022-04-06 13:45:10+00:00,yuk temenin oshi ku ngdota yang mau mabar bisa langsung join ya jangan lupa di follow yaa gais 
1901,2022-04-06 13:41:03+00:00,malam semuanya malam ini skardi nala dan juga kato mau petualangan di dunia generation zero dunia perobotann 
1902,2022-04-06 13:17:02+00:00,sampurasun ini jadwal minggu ini ya belajarnyunda pindah kjumat ya guys a jangan sampai ketinggalan 
1903,2022-04-06 13:09:24+00:00,yuk gas mampir kkotoba station hari ini ada kak yang bakal main gam needy streamer overload ja 
1904,2022-04-06 13:06:18+00:00,sesuai rikues kalian saat livkamrin alaram sahur ala yuki w semoga bangun pas sahur wkwkwkwk 
1905,2022-04-06 13:04:07+00:00,selamat malam bagaimana kabarnya sekarang coco sedang mencoba untuk menggambar sekaligus freetalk semoga kamu suk 
1906,2022-04-06 12:49:44+00:00, en join us in history and sciencbehind instant noodles id yok join buat ngomongin sejarah dan sciencdibali 
1907,2022-04-06 12:31:03+00:00,ayo kita menggali gali vtuber vtuberid minecraft 
1908,2022-04-06 12:00:38+00:00,yo minna malam ini ryoz mencoba pokemon tetapi mmo comand chill with us dat rabu april tim 
1909,2022-04-06 11:41:04+00:00,dukung dalam costumreveal terbarunya vtuberid vtuber 
1910,2022-04-06 11:36:00+00:00,jadwal livestream malam ini gmt apeegends verionlivvtuber 
1911,2022-04-06 10:48:56+00:00, model revealed wreach thgoal thankyou so much nightowls aku sangat mengapresiasi semangat kalian 
1912,2022-04-06 10:20:27+00:00,alhamdulillah lancar juz walau bising ama hujan semoga berkah di bulan puasa ini kalian semua sankyu sudah li 
1913,2022-04-06 09:42:36+00:00,aloo aloo semuaa video baru udah ada nih di youtubvall jangan lupa mampir ya link ma 
1914,2022-04-06 09:23:55+00:00,boleh atuh aa nyobian heula link wawanchandrawirata wa in vtuberid vtuber hoshikazo 
1915,2022-04-06 09:15:42+00:00,selamat sorgimana kabarnya sekarang coco sedang main stumblguys bareng dan kurosai semoga bis 
1916,2022-04-06 08:55:53+00:00,nanti malam kita night run di assetto corsa comjoin mdi stream malam ini jam wijangan lupa datang y 
1917,2022-04-06 08:31:31+00:00,besok debut jangan lupa datang ya man teman kamis april jam malam wi waiting room 
1918,2022-04-06 08:03:46+00:00,kondamang stream pertama di bulan puasa ayolah kita seru seruan bareng tim gmt waiting room 
1919,2022-04-06 07:42:04+00:00,let s drawing ryoku chaan sambil ngabuburit owo link vtuberid vtuberen 
1920,2022-04-06 07:23:54+00:00, mengaji lanjut juz semoga bulan puasa ini mendapatkan berkahnya amiiin dat april tim 
1921,2022-04-06 07:22:45+00:00,main ml modsantai start wivtuber vtuberuprising inukiba doggokiba vtuberid 
1922,2022-04-06 07:17:03+00:00,wah kagak nyangka aja sudah sampai subs thbanget ya yang sudah subs ququu di youtusemoga kalian terhi 
1923,2022-04-06 07:03:08+00:00,makasi ka chibi aku kyeuuuut banget hehvtuber vtuberid vtuberuprising vtuber a d 
1924,2022-04-06 06:20:03+00:00,hewwo teman teman bulan ini aku akan beberapa kali livdi bstation westreaming amp nonton animmilik bilibili t 
1925,2022-04-06 06:14:31+00:00,yuhuu yaibou jam kita ngabuburit bareng main tembakan yuk yayatsan 
1926,2022-04-06 06:08:27+00:00,plant vs zombi ada yang kangen dengan gamini vtuber indonesia general nagatakouuta fanart 
1927,2022-04-06 05:54:08+00:00,jadwal livestream malam ini gmt freetalk shizumimizuki 
1928,2022-04-06 05:46:55+00:00,selamat siang bagaimana kabarnya sekarang coco sedang main valorant semoga bisa menemani kegiatan mu di siang ini 
1929,2022-04-06 05:16:19+00:00,halo semua aku natsuminiirvetta your kawaii mermaid aku ingin mengundang kalian untuk datang kredebut stream ak 
1930,2022-04-06 04:53:01+00:00, gamstream halo siang semuanya yang puasa harus tetap kuat ya malam ini vira main gamunpacking di tung 
1931,2022-04-06 04:30:16+00:00,yuk ngobrol bareng sama aku streaming and chill d kamis april wi gmt waiting room 
1932,2022-04-06 04:14:36+00:00,review untuk spring anim telah selesai my top must watch list spy family summer timrender to 
1933,2022-04-06 03:49:20+00:00,yuk mampir katanya dotaan sampjam nih jangan lupa di follow ya gais udah swag banget soal nya 
1934,2022-04-06 03:11:00+00:00,malam ini ngobrolin banyak macam tentang mcu marvel cinematiunivers bersama 
1935,2022-04-06 03:04:44+00:00,terima kasih orang baik ayok bareng bareng menjadi lebih baik lagi i lovyou ramadachi vtuber 
1936,2022-04-06 02:38:12+00:00,pendaftaran kami masih dibuka sampai tanggal april ayo buruan daftar jangan sampai menyesal informasi au 
1937,2022-04-06 02:09:40+00:00, qualifying ingin menempuh jalan yang lebih serius champions maksudnya v vtuber indon 
1938,2022-04-06 02:04:34+00:00,morning nicday play rpg ain t it tanggal bakal main chrono cross nih sesuai diperkirakan karena sudah beli 
1939,2022-04-06 01:32:49+00:00,good morning gambaran sederhana riana mweheheh walaupun banyak kesalahan di layer tapi riana udah berusah 
1940,2022-04-06 01:00:01+00:00,akhirnya bisa sambung begal jombl zombilagi xgaming isa lanjut main timpuk oi id crabu april 
1941,2022-04-05 23:45:19+00:00,kyubi bukan lalet lagi gaesss ada yang bisa tebak ga jadi apa special aju baru kyubi ap 
1942,2022-04-05 23:20:16+00:00,omg sorry guys lupa buat waiting roomnya untuk hari ini huhuhu nyambi ngabuburit tanggal april jam 
1943,2022-04-05 20:32:05+00:00,selamat pagi selamat berpuasa bagi yang menjalankannya sekarang coco sedang main genshin impact semoga bisa menem 
1944,2022-04-05 17:17:15+00:00,gotta go fast laaaa menuju sonihedgehog movi rilis mainin sonigenerations aja dlu selasa april j 
1945,2022-04-05 17:03:03+00:00,otra sankyu sudah mampir sankyu sudah temani chat sankyu juga udah liksankyu semua hidrora 
1946,2022-04-05 16:54:09+00:00,mencoba stream dsni reality vtuberid pngtuber 
1947,2022-04-05 16:25:24+00:00,yacharoo minna ngebolang bareng membership tawuran lawan serangga sekalian sahur yuk rabu april 
1948,2022-04-05 15:53:38+00:00,ap dicarry dua pituber cew ardha vtuber vtuberid vtuberindonesia 
1949,2022-04-05 15:20:43+00:00,selamat malam selamat beristirahat sekarang coco sedang main thouter worlds semoga bisa menemani waktu tidur ka 
1950,2022-04-05 14:37:58+00:00,alarm sahur buat kamu cek disini alarmsahur keitakeiko vtuberid 
1951,2022-04-05 14:10:11+00:00,what english caption should i put her kanjeng mai wkwkwkkwkwkwkw thanks man lt lt fellow vtuber a 
1952,2022-04-05 14:03:34+00:00,assalamualaikum wr w yuk cek updatkonten terbaru hidayat hehlink on bio vtuber 
1953,2022-04-05 13:57:26+00:00,gas valo yok setelah tarwih zelin von vihlock okicollabkawan apeegends 
1954,2022-04-05 13:43:27+00:00,akan mengguerilla stream sebentar lagi untuk test seberapa parah saya buta nada hiks 
1955,2022-04-05 13:38:44+00:00,hewloo guys jadi di video kali ini rika akan menjawapertanyaan dari kalian thanks for subscriber 
1956,2022-04-05 13:25:35+00:00,terima kasih atas inspirasi dan kesempatannya hari ini amp sukes terus waroeng nya bun 
1957,2022-04-05 13:11:31+00:00,selamat malam bagaimana keadaan mu sekarang coco sedang main apelegends semoga bisa menemani kegiatan mu di mal 
1958,2022-04-05 13:05:48+00:00,lupa post w makasih yg uda dukung dan bantu yuki dibulan maret buat cepet punya ld w vtuberid vtuber 
1959,2022-04-05 12:18:26+00:00, mau ingetin t shirt untuk masih dijual tanggal bakal tutup pr 
1960,2022-04-05 12:17:13+00:00,today stream littlnightmares ii 
1961,2022-04-05 12:15:06+00:00,today stream freetalk minecraft 
1962,2022-04-05 11:57:30+00:00,livsantuy main storyofseason friendsofmineraltown gt w gt dah lama ga lanjutin jadi kangen w mari saksikan ubur 
1963,2022-04-05 11:42:14+00:00, model reveal tim halo nightowls violetta lupin disini dan aku seneng banget untuk bisa ngreveal mod 
1964,2022-04-05 11:24:41+00:00,siapa sangka jika telah hadir vtuber d yang pindah kversi png karena tidak kuat mesinnya pngtuber 
1965,2022-04-05 11:01:03+00:00,bentar lg buka puasa yeeey w berbukalah dengan yg manis dan menyegarkan seperti wjelly drink w or may
1966,2022-04-05 11:00:22+00:00,anjay aku bisa joged vtuberid envtuber vtuberen vtuberuprising 
1967,2022-04-05 10:37:56+00:00,cat mario ni gamkeknya ez vtuber indonesia general nagatakouuta fanart kouutarts streams 
1968,2022-04-05 10:34:32+00:00, indonesia only gibewey still openn sini join satu email satu entry vtuberid idvtuber vtuberindo 
1969,2022-04-05 10:25:04+00:00,alhamdulillah otra sankyu yang sudah mampir sankyu juga sudah likselesai juga juz k semoga puasa kit 
1970,2022-04-05 10:14:48+00:00,saatnya maha fanart othweek sambil ngabuburit teman teman ini adalah fanart keren dari dan 
1971,2022-04-05 09:53:38+00:00,donathon mimpi apa kalian tadi episod vtuber vtuberid vtuberindonesia 
1972,2022-04-05 09:48:11+00:00,selamat sorgimana kabarnya sekarang coco sedang main call oduty mobil semoga bisa menemani ngabuburit kamu 
1973,2022-04-05 09:46:53+00:00,new clip sebuah perbedaan di youtubdan di real litapi gak begitu juga kelakuan anehnya 
1974,2022-04-05 09:35:22+00:00,udah sebulan ternyata jadi vdj kemunculan pertama maret di freetalk lalu dugem onlinpertama 
1975,2022-04-05 09:05:00+00:00,part lanjutan review masih banyak animyang mau kubahas belum sempat tadi pagi abu april w 
1976,2022-04-05 09:01:38+00:00, ales oberseria ngabuburit meet mbak velvet versi halal tentunya room via 
1977,2022-04-05 08:57:13+00:00,thr dulu yah vtuber vtuberid vtuberuprising twitchclips twitchstreamers twitch 
1978,2022-04-05 08:51:57+00:00,assalamu alaikum sekilas tentang azzra salam kenal semuanya azzramadhania vtuber vtuberid 
1979,2022-04-05 08:17:34+00:00,weekly schedulbuat apr ya redoers feedback livdiskusi bareng sahur stream setiap jam widan 
1980,2022-04-05 08:04:40+00:00,definisi ga pernah main tapi nekad main onstream minecraft solo stream wi gmt 
1981,2022-04-05 07:47:56+00:00,hello travelers haruna akan melanjutkan story di gamvisagsambil nungguin buka puasa yuk temenin haruna t 
1982,2022-04-05 07:47:53+00:00,untuk informasi lebih lanjut jika berminat ikut audisinya silahkan isi form di bawah ini 
1983,2022-04-05 07:47:46+00:00,mau nguli buat gajian minggu ini nanti seyou wiveela lagi liv 
1984,2022-04-05 07:35:52+00:00,ngobrol yok bareng kita bersama tamu kesayangan kalian vtuberid rasumaid 
1985,2022-04-05 06:56:47+00:00,haegais kalian gabut siang siang yuk join klivkak jo mari menguli sambil nunggu berbuka 
1986,2022-04-05 06:52:46+00:00,official art april sudah tersedia ya redoers biar makin wangy suasana bulan ramadan berasa ngabuburit bareng di ma 
1987,2022-04-05 06:37:38+00:00,let s help vall to reach subscribers yuk mampir buat yg belum vtubersen 
