,Date,Tweet
1988,2022-04-05 06:33:08+00:00,jadwal jadwalan yang bisa banget berubah kalo mendadak bimbingan revisi theodolivtheodolydd vtuberid 
1989,2022-04-05 06:26:24+00:00, mengaji lanjut ngaji ya kjuz semoga puasa kita mendapatkan berkah amiiin dat april tim 
1990,2022-04-05 06:24:41+00:00,sabtu fotoin makanan buka puasa kalian dong boleh kirim foto makanan khas ramadhan dari daerah kalian juga lho k 
1991,2022-04-05 06:24:41+00:00,jumat collavoicact di streamnya senpai link menyusul kalian bisa request lewat gform berikut y 
1992,2022-04-05 05:54:34+00:00,p apepmobel with start wivtuber vtuberuprising 
1993,2022-04-05 05:06:02+00:00,siang semua gimana udh pada tepar btw aku upload shorts nihh vtuber vtuberuprising vtuberdebut vtuberid 
1994,2022-04-05 03:54:07+00:00,let s drawing yuki chaan sambil ngabuburit owo link vtuberid vtuberen virtualyoutuber 
1995,2022-04-05 03:34:26+00:00,punggung andi encoog jangan lupa mampir kchannel shinichi id link clip andiadinata 
1996,2022-04-05 03:31:24+00:00,kostum baru andi makin badas atau makin kawaii jangan lupa mampir kchannel shinichi id link clip 
1997,2022-04-05 03:24:57+00:00,apakah kaela benar benar penguin jangan lupa mampir kchannel shinichi id link clip 
1998,2022-04-05 02:30:00+00:00,hewoooo agrarian can t believi makthis ramadhan adalah bulan berkah yang artinya bulan penuh stream zizan 
1999,2022-04-05 02:15:02+00:00, ssalamu allaikum semuanya ini kisah seorang gadis yang muncul dari cahaya bulan ia ditugaskan kebumi untuk s 
2000,2022-04-05 01:28:21+00:00,schedulbuat minggu ini jangan lupa mampir ya waiting room bakal diupdatpagi siang atau di hari streamnya ja 
2001,2022-04-05 01:02:51+00:00, lanjuttt vtuber vtubers vtuberid vtuberclips gamer youtuber gaming racing 
2002,2022-04-05 00:44:30+00:00, streaming dadakan curhatt april wi gmt kyuliv 
2003,2022-04-04 23:59:57+00:00,pagiii ceman ceman tips biar puasa kamu gak gampang batal fyp fyp askargreshaqi askartips indievtuber 
2004,2022-04-04 23:38:53+00:00,ohaion o d o today is my bday will you celebratit with mtonight a bday stream link 
2005,2022-04-04 20:48:30+00:00,assalamualaikum wr w yuk cek updatkonten terbaru hidayat hehevtuber vtubers 
2006,2022-04-04 20:43:41+00:00,assalamualaikum wr w yuk cek updatkonten terbaru hidayat hehevtuber vtubers 
2007,2022-04-04 20:29:11+00:00,selamat pagi selamat berpuasa bagi yang menjalankannya sekarang coco sedang main genshin impact semoga bisa menem 
2008,2022-04-04 16:43:16+00:00,ikutan trend nya aoikakitsuna vtuberid 
2009,2022-04-04 15:50:48+00:00,jadwal minggu ini yeessssss strheam alterly vtuberid vtuber 
2010,2022-04-04 14:54:35+00:00,yuk jangan lupa mampir di kotoba station ada kak joana dan di twitch ada nenek ryouko yang lagi liv lesgoww ry 
2011,2022-04-04 14:12:28+00:00,selamat malam selamat beristirahat sekarang coco sedang main thouter worlds semoga bisa menemani waktu tidur ka 
2012,2022-04-04 14:07:00+00:00,ini aja masih nguli buat ayato eh ditambah lembur nguli lagi genshinimpact kamisatoayato vtuber vtuberid 
2013,2022-04-04 13:53:13+00:00, ayok sampsahur gan vtuberuprising vtuber vtuberid 
2014,2022-04-04 13:34:27+00:00,schedul april april not waktu dapat berubah tanpa pemberitahuan sebelumnya hidrora raliv 
2015,2022-04-04 13:18:04+00:00, masih ada t shirt untuk gen snowdrop heli leon dan louismasih buka preorder loh buruan tanggal 
2016,2022-04-04 13:15:04+00:00, celebration selamat ramadhan h m segenap management staadmin dan talent dari reality team men 
2017,2022-04-04 13:14:31+00:00,yacharoo miracl kayanya udah lama aja gak ada weekly schedul livstream apa nih yang kalian tunggu tunggu 
2018,2022-04-04 12:56:51+00:00,selamat malam gimana kabarnya sekarang coco sedang main star wars jedi fallen order semoga bisa menemani kegiatan 
2019,2022-04-04 12:53:40+00:00,minecraft ngegabut bareng di minecraft ardha vtuber vtuberid vtuberindonesia 
2020,2022-04-04 11:11:15+00:00,buka hati untuk chlo clip pawapulivvtuber vtubers vtuberid vtuber 
2021,2022-04-04 10:45:27+00:00,rdebut soon hayooo pada penasaran kaann ditunggu yaaa teman temaann vtuber 
2022,2022-04-04 10:39:13+00:00,alhamdulillah otra sankyu yang sudah mampir sankyu juga sudah likselesai juga juz k besok lanjut lagi 
2023,2022-04-04 10:29:09+00:00,hi perkenalkan aku hanaeri ghina biasanya dipanggil ghina gadis introvert ini sedang berusaha untuk mencari teman 
2024,2022-04-04 10:28:33+00:00,yooshhhh besok siang futsu main bensin liat tempat baru amp jemput ayang waiting room 
2025,2022-04-04 09:35:48+00:00,new clip published cara cepat belajar aksen bri ish can you do this tongutwister vtuberid idvtuber 
2026,2022-04-04 09:34:26+00:00,selamat sorgimana kabarnya sekarang coco sedang main stumblguys semoga bisa menemani ngabuburit kamu 
2027,2022-04-04 09:05:48+00:00,yang ber uang akan selalu kalah dengan yang bikin nyaman link wawanchandrawirata 
2028,2022-04-04 08:54:07+00:00,pingin tau budaya puasa di dunia manusia sharing cerita puasa kalian wigmt 
2029,2022-04-04 08:49:33+00:00, mengaji juz lanjut juz sambil menunggu berbuka puasa kita sambil mengaji ya biar dapat ridho dari allah swt 
2030,2022-04-04 08:43:03+00:00,kondamang sebelum berbuka puasa gumau ngasih sebuah info ayo join bstationnya skalla horisont lo bisa dapetin 
2031,2022-04-04 08:26:00+00:00,video baru udah ada di youtubvall silahkan mampir ya link hidup seperti jerry tom amp jerry chas vtuber in 
2032,2022-04-04 08:15:17+00:00,yuk yang kemarin nunggu jm shanday bisa langsung kyoutubkak jo kalian bisa curhat curhat cerita kirim salam 
2033,2022-04-04 08:07:15+00:00, nachieved karaok atihan nyanyi biar jadi aidoru jam wi ut wr 
2034,2022-04-04 07:55:42+00:00,assalamualaikum semuanya gimana puasa kalian dihari k masih semangat kan karena sudah melebihi retw
2035,2022-04-04 07:54:03+00:00,yoki menyesal vtuber vtuberid vtuberindonesia 
2036,2022-04-04 07:53:14+00:00,konnichinoon darling pluviophiltachi siang menuju soryang puasa masih aman kan semangat ya seiso i 
2037,2022-04-04 07:51:39+00:00, newsletter untuk yang subscribknewsletter mingguan saya kalian sudah bisa mengecek inbokalian masing masi 
2038,2022-04-04 07:22:54+00:00, reetalk ell myour monday april gmt sekarang curhat pakai form yaa nanti kachi lampirin 
2039,2022-04-04 07:13:33+00:00,saya ingin belajar bahasa indonesia tetapi apakah anda memiliki cara yang disarankan untuk mempelajarinya idvtuber vtuberid 
2040,2022-04-04 07:10:45+00:00,tips biar puasa kamu gak gampang batal askargreshaqi askartips indievtuber niatdarihati vtuberid 
2041,2022-04-04 06:44:21+00:00,semangat puasa nya awas kalau alasan ngampus malah belok kwarung bakso cak wawan commish art by 
2042,2022-04-04 06:44:13+00:00,cara cepat belajar aksen bri ish vtuberid vtuberindonesia 
2043,2022-04-04 06:34:33+00:00,pengumuman buat warga kingdom ryo balik stream lagi buat nemenin ramadhan antum sekalian kali ini edisi bubaryo 
2044,2022-04-04 06:29:24+00:00,ayu kita membangun rumah tangga bersama apr gmt jst waiting room 
2045,2022-04-04 06:22:27+00:00,berpacu dalam melodi link musedash rasumaid vtuberid 
2046,2022-04-04 04:57:27+00:00,mau menjelajah maps chasm di genshin impact ahh vtubers vtuber vtuberindonesia vtuberid genshinimpact 
2047,2022-04-04 04:24:49+00:00,i will do subhaton tonitfor celebrataffiliaton twich and maybfacreveal 
2048,2022-04-04 04:05:31+00:00,party kitaa rekkk tahun ini udah k yeyyy party hari ini jam buat yang mo tanya atau ngasih ucap 
2049,2022-04-04 04:04:58+00:00,nanti malam streaming lagi kemarin nyoba garti terus katanya jadi kepengen lagi senin jam 
2050,2022-04-04 03:18:58+00:00,ga tau kucing poi link clip vtuberid mengbukber 
2051,2022-04-04 03:17:39+00:00,yahho minna malam ini kuma bakal ngadain birthday stream lhoo gt lt mwheheheh jangan lupa pada dateng yahh hava n 
2052,2022-04-04 00:58:07+00:00,selamat pagi akhirnya april ngga berasa udah tahun jangan lupa malam ini ada special stream d liv you 
2053,2022-04-04 00:20:02+00:00, subs kyk ying and yang btw belum subs bantu subs dnk oayo dro hidrora vtuberid 
2054,2022-04-03 22:54:34+00:00,donathon sahur apa kalian hari ini episod vtuber vtuberid vtuberindonesia 
2055,2022-04-03 21:05:51+00:00,gaees gaeeesss monchi mau kenalin alya kkalian dan minta bantuan kkalian buat retweet gt lt jangan lupa 
2056,2022-04-03 20:53:26+00:00,hallo guys ku upload vidio nihh main bareng sama kalo kalian pingin tau kita ngapain bisa check dis 
2057,2022-04-03 20:45:48+00:00,sebel ga sih lu capek nyanyi jam tapi videonya kblock gegara kopikanan sedikit clip dari stream karaokkem 
2058,2022-04-03 20:38:20+00:00, assalamualaikum halo semuanya namaku alya syakira aku seorang gadis yang jatuh kedunia virtual saat ada caha 
2059,2022-04-03 20:32:24+00:00,selamat pagi selamat berpuasa bagi yang menjalankannya sekarang coco sedang main genshin impact semoga bisa menem 
2060,2022-04-03 20:24:49+00:00,sahur guys ini jadwalku buat minggu ini general kazehayaren fanart renimaginliv kazehayarenlivclip 
2061,2022-04-03 17:44:19+00:00,hbd to m vtuberid fanart 
2062,2022-04-03 15:30:33+00:00,selamat malam selamat beristirahat sekarang coco sedang main thouter worlds semoga bisa menemani waktu tidur ka 
2063,2022-04-03 15:20:16+00:00,sepi gak ada yang mau likatau komen tweet ku gachacluvtuberid indonesia gachatuber gacha 
2064,2022-04-03 15:05:02+00:00,malam semuanyaa ini stream scheduluntuk minggu depan maybsomguerilla stream menjelang berbuka dan menjela 
2065,2022-04-03 14:58:24+00:00,alhamdulillah baru debut maluuu duh check ya tema teman vtuber vtuberdebut 
2066,2022-04-03 14:57:31+00:00,alhamdulillah baru debut maluuu duh check ya tema teman vtuber vtuberdebut 
2067,2022-04-03 14:49:01+00:00,yuk bunvnv zombiuntuk ngilangin emosi gara gara thmimikemarin link bersama 
2068,2022-04-03 14:29:27+00:00,udah lama lho zizan ga main genshin jadi nanti sahur mau jalan jalan di teyvat nungguin waifu baru yang belum mun 
2069,2022-04-03 14:27:27+00:00,assalamualaikum wr w gimana puasa hari pertama kalian sahabat udah pada shalat tarawih belum heh
2070,2022-04-03 13:53:49+00:00,hai semua kenalin aku ishiguro kurumi vtuber indonesia ga niat voicactor kalian bisa panggil aku kurumi 
2071,2022-04-03 13:23:36+00:00,selamat malam gimana kabarnya sekarang coco sedang main stumblguys semoga bisa menemani malam mu 
2072,2022-04-03 13:05:00+00:00,nya nya vtuber vtuberuprising vtuberid tiktok tiktokviral 
2073,2022-04-03 12:15:35+00:00,malem ini aku mau marathon gamgod eater resurrection greget banget kalah mulu dr kemaren semangatin dong 
2074,2022-04-03 11:50:36+00:00,wadow gara gara livpritalk tadi pagi subs naik terimakasih kepada para pelanggan yang sudah subs selama ini 
2075,2022-04-03 11:39:16+00:00,malam ini lho jangan lupa debut pertama jam malam waiting room 
2076,2022-04-03 11:26:07+00:00,jadwal livestream malam ini gmt apeegends aruraibu tnmwin 
2077,2022-04-03 11:23:48+00:00,today stream donathon vft a 
2078,2022-04-03 11:11:40+00:00,selamat berbuka puasa para hoshifamily hoshinnara vtuberid vtuber puasa ramadhan 
2079,2022-04-03 10:58:38+00:00,alhamdulillah juz selesai besok gw lanjut bacanya sankyu untuk yang sudah mampir maabacaan gw masih terbatah 
2080,2022-04-03 10:32:39+00:00,menyambut ramadhan dengan sepenuh hati menjalankan dengan hati yang suci dan jadikan ramadhan yang berseri sel 
2081,2022-04-03 10:11:43+00:00,oh ya sebelum keburu dah buka puasa gumau ngucapin selamat menunaikan ibadah puasa buat yang menjalankannya 
2082,2022-04-03 10:04:04+00:00,mohon maasebelumnya dari minggu yang lalu bahkan lebih kayaknya baru sekarang bisa kasih informasinya jad 
2083,2022-04-03 09:57:37+00:00,dateng ya sweeties kita ngabuburit bareng swiftylivvtuberid 
2084,2022-04-03 09:45:42+00:00,ngabuburit bareng teman seperumputan guys vtuberdebut vtuber vtuberid vtubers 
2085,2022-04-03 09:36:38+00:00,selamat sorgimana kabarnya sekarang coco sedang main call oduty mobil semoga bisa menemani ngabuburit kamu 
2086,2022-04-03 09:35:14+00:00,kalau gatahan gapapa kok vtuberid vtuber envtuber vtuber a d a avtuber seihyu 
2087,2022-04-03 09:11:19+00:00,halo man teman sambil nunggu buka puasa adzan magri nongkrong bareng yuk nua akhirnya nyobain forza horizon 
2088,2022-04-03 08:58:26+00:00,chika pendek wkwkwk chika kamera clip chikakameria chikadiclip vtuber vtubers 
2089,2022-04-03 08:56:20+00:00,liv mnit lagi hidrora ralivvtuberid 
2090,2022-04-03 08:26:54+00:00,otsu rion everyon thanks buat yang udah mampir kstreamku tadi seyou all in thnstream video 
2091,2022-04-03 08:08:25+00:00,marhaban ya ramadhan comrad selamat menunaikan ibadah shaum ramadhan h bagi yang menjalankannya tetap sem 
2092,2022-04-03 07:35:09+00:00,jaga yang bener kalo rumah kalian kosong new video released check it out her vtubers 
2093,2022-04-03 07:04:41+00:00,anak anak katanya mau ngabuburit bareng jadi sekalian streaming deh sekalian fesripil 
2094,2022-04-03 06:30:00+00:00,ada sena di dalam sena clip yumeclips freetalk nekoyamasena yumereality 
2095,2022-04-03 06:21:19+00:00,tips biar puasa kamu gampang batal askargreshaqi askartips indievtuber youngleniatdarihati vtuberid 
2096,2022-04-03 06:17:37+00:00, harika rika is now liv freetalk menit guys lewat vtuberid vtuberuprising vtuber 
2097,2022-04-03 06:09:01+00:00, mengaji juz menunggu berbuka puasa kita sambil mengaji ya biar dapat ridho dari allah swt dat april 
2098,2022-04-03 05:13:47+00:00,fretalk stream jam wi pm gmt semoga gak turun hujan lagi d waiting room 
2099,2022-04-03 05:07:27+00:00,hewloo guys jadi rika mau streaming debut nih kita ngobrol santai yuk temenin rika ngobrol waktu bisa beru 
2100,2022-04-03 04:26:18+00:00,schedulnya gw ganti ya tadi salah tanggal ini schedulbulan ramdahan ini mengaji hari juz setiap jam 
2101,2022-04-03 03:42:53+00:00,hampir lupa ada jadwal sunmocha pagi ini mengobrol ngobrol santuy aja karena aku belum siapin topik wkwk sunday 
2102,2022-04-03 03:32:56+00:00,yuhuuu theo is back from ngumrat skripsi gada otak gada akhlak mau pulang naik kereta abis bimbingan malah dik 
2103,2022-04-03 02:44:43+00:00,pritalk bersama pituber vtuber vtuberid raizubartender 
2104,2022-04-03 00:55:32+00:00,siapa yang udah banguun ayok kita mabar mobillegends pagi pagi dateng ya jam pagi ini hoho 
2105,2022-04-03 00:53:22+00:00,freetalks kenalan bareng amaya ardha vtuber vtuberid vtuberindonesia 
2106,2022-04-03 00:35:37+00:00,pagi men stream apemobildadakan dulu vtuberid apeegendsmobilyudalivvtuber 
2107,2022-04-02 23:28:58+00:00,sorini jam wireinandarea vtuber vtuberid 
2108,2022-04-02 22:53:05+00:00,freetalks pada stream sahur jadi saya ikutan ardha vtuber vtuberid vtuberindonesia 
2109,2022-04-02 22:14:33+00:00,ngaku kalian siapa yang baru imsak udah bolong puasanya merapat kuy nanti sor wi 
2110,2022-04-02 21:36:01+00:00,pervtuberan indonesia suka tidak suka komentar bagikan laporkan premier u 
2111,2022-04-02 21:23:13+00:00,apacoba selamat menjalankan ibadah puasa bagi yang menjalankan koneksi baru bener ish sahur ramadhan vtuberid 
2112,2022-04-02 21:02:39+00:00,orenjii kun vtuber vtuberid 
2113,2022-04-02 20:33:03+00:00,selamat pagi selamat berpuasa bagi yang menjalankannya sekarang coco sedang main genshin impact semoga bisa menem 
2114,2022-04-02 20:00:01+00:00,asli bikin kaget ini clip pawapuliv chloepawapua vtuberindo vtuberid vtuber 
2115,2022-04-02 19:31:33+00:00,yuk sahur bareng sweeties swiftylivvtuberid 
2116,2022-04-02 18:30:59+00:00,sini lina temenin sahur waiting room vtuber vtuberid 
2117,2022-04-02 16:32:27+00:00,sahur vtuber indonesia lewat wireinandarea vtuber 
2118,2022-04-02 16:24:15+00:00,nih oshi ku nemenin yang mau begadang nunggu sahur kalian jangan lupa mampir ya 
2119,2022-04-02 16:21:31+00:00,ramadhan mubarak dan selamat menjalankan ibadah puasa bagi teman teman yang menjalankan semoga bulan ramadhan kal 
2120,2022-04-02 16:04:41+00:00, kouu pi urhatan malam minggu vtuber indonesia general nagatakouuta fanart kouutarts streams 
2121,2022-04-02 15:49:33+00:00,biar semangat dikit puasanya ges yak gw bakal nemenin sahur kalian di sahuryo saur bareng ryo h nya mana wkwkwk 
2122,2022-04-02 15:08:19+00:00,halo rasuma disini nyari horror horror yok temenin kita di kelilingi para zomai with 
2123,2022-04-02 14:55:55+00:00, night zeal ch is now liv random gabut belajar buat overlay canva lewat 
2124,2022-04-02 14:37:25+00:00, announcement akh akhirnya aku nii nikaahhhh edragon nest revolution a vtuberid 
2125,2022-04-02 14:29:56+00:00,selamat malam selamat beristirahat sekarang coco sedang main thouter worlds semoga bisa menemani waktu tidur ka 
2126,2022-04-02 14:10:51+00:00,review memdari paman paman ya gaes am wi april vtuberid vtuber vtuberuprising pngtuber 
2127,2022-04-02 13:34:51+00:00,hey dhampriends mumpung ini sebelum puasa dhampirmau upload konten cover mengsedih nih hayuuk mampiirr mu 
2128,2022-04-02 13:27:02+00:00,hello travelers malam ini haruna akan mencoba mirasa baru dan juga potato chip rasa ghost pepper di stream 
2129,2022-04-02 12:55:34+00:00,kisah naga hijau indonesia version era chapter melihat foto go d aldia akan rilis di mangatoon rilis pada t 
2130,2022-04-02 12:47:13+00:00,tak terasa besok sudah puasa mari begadang ampek sahur mulai jam malam ini wr 
2131,2022-04-02 12:29:33+00:00,selamat malam baru kelar nguli jadi baru bisa streaming sorry tidak mengikuti sesuai jadwal i hopi ll seyo 
2132,2022-04-02 12:06:40+00:00,elencasso livnow d d malam ini elen mau bercerita sambil menggambar sini merapat elen bacain kamu 
2133,2022-04-02 11:45:07+00:00,konmaikaaaa jangan lupa dateng kpremiercover identity maika menit lagi ya seyou thermaikawan vtuber 
2134,2022-04-02 11:21:38+00:00,keiko juga ada disini yaaa jangan ketinggalan premierjam gt lt keitakeiko d d coversing 
2135,2022-04-02 11:17:08+00:00,jadwal livestream malam ini gmt apeegends aruraibu 
2136,2022-04-02 10:58:26+00:00,wah dapet fanart pertama kaliii eii thya thbanget yaa ara ara asikk pertama kali quart qudisan 
2137,2022-04-02 10:55:50+00:00,bang kok kamu anim vtuber vtuberid idvtuber djvtuber funkot dugem onlin
2138,2022-04-02 10:42:44+00:00,ayo guys ramein nanti miyu ada di sini yaaa www pertamakali ni ajak colla jangan lupa datang vtuberid 
2139,2022-04-02 10:38:45+00:00,selamat sorgimana kabarnya sekarang coco sedang main frefir semoga bisa menemani sorhari mu 
2140,2022-04-02 10:12:55+00:00, priliv reetalk ngobrol senja attid lewat aprilivvtuberid vtuberuprising 
2141,2022-04-02 10:12:31+00:00,new clip kali ini membuat menderita vtuber vtuberid vtuberclip 
2142,2022-04-02 09:48:19+00:00,elencasso is back d d malam ini elen mau bercerita sambil menggambar sini merapat elen bacain kamu buku 
2143,2022-04-02 09:30:00+00:00,zizan akan menemani hari pertama sahur dengan nonton bareng ga perlu discord langsung buka twitch zizan aja xm 
2144,2022-04-02 09:30:00+00:00,berita buruk clip gitamelodia simphony gitaonair aoi id vtuberindo 
2145,2022-04-02 09:16:23+00:00,hari ini rhea bakal ada princess training dulu sebelum stream jadi kemungkinan streamnya agak terlambat ya gens 
2146,2022-04-02 09:14:54+00:00,today stream odkeras cowok xmalming tapi sama lala ah kecal wi ut waiting room 
2147,2022-04-02 08:42:58+00:00,hmmm malming sebelum puasa kok kayaknya asik ya collaamong us biar adu domba dan saling menuduh sebelum dosa ka 
2148,2022-04-02 08:37:23+00:00, virtualiqo chapter rukun islam insya allah pada sorhari sabtu ini kita akan mendalami kmateri 
2149,2022-04-02 08:34:32+00:00,clip gameplay codm btw selamat beribadah puasa bagi yang muslim dan ada kabar juga bahwa setelah saya hiatus be
2150,2022-04-02 08:27:26+00:00,stream streamnya ququu dibuatnya mendadak ququu hari ini main identity v yolo tanggal april jam 
2151,2022-04-02 07:38:28+00:00,halooo minna lina udah baikan nih dan mau ganti morning stream jadi genshin impact temenin lina farming yuk waiti 
2152,2022-04-02 06:30:00+00:00,nolep tapi kawaii clip yoopoopipoopielivvtuberindo virtualyoutuber vtuberid vtuber 
2153,2022-04-02 06:26:51+00:00,muck mari kita mencari cara keluar dari pulau vtuber indonesia general nagatakouuta fanart 
2154,2022-04-02 06:24:53+00:00,video baru udah tayang jangan lupa mampir ya link mari kabur dari rumah nenek granny housonlin vtuber i 
2155,2022-04-02 06:17:13+00:00,so mion s first cover song is this gimana nih keliatannya for now enjoy shor teasernya dulu ya bakal aku sha 
2156,2022-04-02 06:07:10+00:00,nyoba gambar di medibang pakmouswwwwwww agak susahh qwq lutiefiggy art nomnomlutidangolutivtuber 
2157,2022-04-02 06:03:49+00:00,today stream is cragamwith jadwal berubah menjadi jam jam wi pm gmt apakah kami 
2158,2022-04-02 05:53:07+00:00,livdadakan bersama cibaduyut team gmt waiting room 
2159,2022-04-02 05:49:39+00:00,selamat siang gimana kabarnya sekarang coco sedang main left dead bareng semoga bisa menema 
2160,2022-04-02 04:26:58+00:00, set remindernya ya kita juga bakal sekalian ngreview channel vtuber yang kamu rekomendas 
2161,2022-04-02 04:10:04+00:00,daily ramadhan vtuber apreciation hai gaes selama saat sahur bulan ramadhan ini aku mau keliling mencari vtuber y 
2162,2022-04-02 03:30:00+00:00,chloberasal dari upil clip pawapuliv chloepawapua vtuberindo vtuberid vtuber 
2163,2022-04-02 03:23:15+00:00,cari anggota baru lagi pirk rasumaid vtuberid 
2164,2022-04-02 02:46:28+00:00,aku gugup freetalk all with dugongers april wi gmt 
2165,2022-04-02 01:57:12+00:00,pagi para pelanggan pagi bagi berburu keluarganya yuk di dautless raizubartender vtuber 
2166,2022-04-02 01:34:46+00:00,selamat pagi apa kabarnya sekarang coco sedang main call oduty mobil semoga bisa menemani pagi hari mu 
2167,2022-04-01 22:33:15+00:00,bangun pagi buka hp liat joa ngsimp lagi joanamaoh vtuberuprising vtuberid 
2168,2022-04-01 17:20:25+00:00,maaya buat konten hari ini cuman singkat bgt soalnnya masalah jaringan thank you yang udh sempat dtg 
2169,2022-04-01 15:40:15+00:00,bismillahirrahmanirrahim jadi tanggal debut insyallah tetap hari ahad tanggal ramadhan h vtuberindo 
2170,2022-04-01 15:39:35+00:00,selamat malam selamat beristirahat sekarang coco sedang main genshin impact semoga bisa menemani waktu tidur kamu 
2171,2022-04-01 15:33:37+00:00,valo lagi nih gasin gais mampir jangan lupa di follow ryoukochikagvtuberuprising 
2172,2022-04-01 14:53:32+00:00,ap ngapebareng leyhad amp sato ardha vtuber vtuberid vtuberindonesia 
2173,2022-04-01 13:09:52+00:00,ikuzoo kita main sambil ngobrol ayang ayang sama uwu vtuber vtuberid 
2174,2022-04-01 13:08:45+00:00, ostumreveal ostum baru rdebut tuber indonesia lewat kemon nonton guys vtuberid vtuber 
2175,2022-04-01 13:02:42+00:00,selamat malam selamat beristirahat sekarang coco sedang main gratiphonbersama teman teman vtuber semoga bisa 
2176,2022-04-01 12:59:46+00:00, temenin yuk vtuberid vtuber vtubers 
2177,2022-04-01 12:36:51+00:00,first timliv raft with hari aprilmop maen survival tanggal jumat april jam 
2178,2022-04-01 12:33:25+00:00,hallo selamat malam semuanya malam ini seperti biasa arata mengadakan livstream berupa konten freetalk bersam 
2179,2022-04-01 12:19:13+00:00,angjay elden ring zero det no hoaks mampir aja kalo nggak percaya gw sih nggak percaya 
2180,2022-04-01 12:02:37+00:00,today stream kitsuntalk hu 
2181,2022-04-01 10:54:30+00:00,kobo yang sangat serem jangan lupa mampir kchannel shinichi id ya link clip 
2182,2022-04-01 10:52:55+00:00,kata kata zeta yang sangat ambigu jangan lupa mampir kchannel shinichi id ya link clip 
2183,2022-04-01 10:45:52+00:00,alhamdulillah jazakumullah khoir teman teman yang sudah hadir mohon maaya atas ketidaknyamanan akibat delay da 
2184,2022-04-01 10:25:35+00:00,otsunuhun semuanya hari ini tantgirang sekali dengan reaksi kaget kalian gimana baru pertama kali kalian ketem 
2185,2022-04-01 09:51:45+00:00,ketika zombilawan tanaman plwntsvszombies vtuberid rasumaid 
2186,2022-04-01 09:51:28+00:00, streaming dadakan ga jadi karaoknya dikatain muluuu malessss april wi gmt 
2187,2022-04-01 09:30:00+00:00,yabsekali lagunya clip lilyliv lilyifeta vtuberindo virtualyoutuber 
2188,2022-04-01 09:29:08+00:00,selamat siang selamat beraktifitas sekarang coco sedang main point blank semoga bisa menemani kegiatan mu di sian 
2189,2022-04-01 09:19:16+00:00,april mop gess ayooo mira mau ngapain jumat april wi gmt waiting room 
2190,2022-04-01 08:58:35+00:00,yahoo yahoo revengdebut stream lets goo guys uwu tanggal april jam wilink 
2191,2022-04-01 08:29:29+00:00,random stream valo ueu alorant valo lesgo tuber indonesia jumat april gmt jangan lupa 
2192,2022-04-01 08:07:53+00:00,ud lama ga gambar dan umbreon nya jadi aneh hahaha kalau soal pokemon pada suka pokemon apa vtuber vtuberid 
2193,2022-04-01 07:33:59+00:00,selamat siang guysssss selamat datang di bulan aprillll malam ini yuk ngobrol bareng selena sekalian nanti ma 
2194,2022-04-01 07:21:00+00:00,selamat siang selamat beraktifitas sekarang coco sedang main star wars jedi fallen order semoga bisa menemani keg 
2195,2022-04-01 07:03:49+00:00,terima kasih jamur orennya selama bulan maret kemarin guys vtuberid vtuberuprising vtuberindonesia 
2196,2022-04-01 06:57:20+00:00,termiakasih kepada para pelanggan yang sudah memberikan support selama ini agar raizu dapat lebih berkarya lagi 
2197,2022-04-01 06:56:43+00:00,mobillegends ayo kita bermain bersama vtuber indonesia general nagatakouuta fanart kouutarts st 
2198,2022-04-01 06:02:54+00:00,tenang bukan april fools atau april mop kok yak malah special content updatmodel ld baru men jumat april 
2199,2022-04-01 06:00:01+00:00,halo sayang gak kerasa ya dah april nanti aku mau kasih tau sesuatu di stream jadi jangan lupa dateng ya t 
2200,2022-04-01 04:03:26+00:00,link affiliasi menguntungkan jgn sampga di scan mekarbersamamu vtuberid vtuberen vtuberrising 
2201,2022-04-01 04:00:14+00:00, fandubrizal numpang sharfandukawan kawan ditonton ya hari minggu nanti 
2202,2022-04-01 03:38:40+00:00,bukan april fools tapi emang mo masak gais ntar siang dateng ya wkwkwkkwk d livon 
2203,2022-04-01 03:30:00+00:00,cari waifu lagi clip pawapuliv chloepawapua vtuberindo vtuberid vtuber 
